h1.jpg,토마스모어,TE4-TS03 플리스 후드-네이비,49700,Black,Hoodie,Low,No
h2.jpg,디스이즈네버댓,T-Logo LT Hoodie Fushsia,76000,Red,Hoodie,Mid,Yes
h3.jpg,토마스모어,TE4-TS03 플리스 후드-베이지,49700,Ivory,Hoodie,Low,No
h4.jpg,베를린포토북디스트리뷰션,Werbespruch 001 HOODIE (RED),139000,Red,Hoodie,High,Yes
h5.jpg,디스이즈네버댓,T-Logo Hoodie Heather Grey,76000,Gray,Hoodie,Mid,Yes
h6.jpg,제멋,아크 롤링 오버핏 기모 후드 5종 네이비,42900,Navy,Hoodie,Low,Yes
h7.jpg,노스페이스,미니 박스 로고 후디 풀오버 NM5PQ51M_BRW,70210,Brown,Hoodie,Mid,No
h8.jpg,유니어패럴,베이직 기모 Hoodie 그레이,33900,Gray,Hoodie,Low,No
h9.jpg,케일,ALPHA PULLOVER (Beige),175000,Ivory,Hoodie,High,No
h10.jpg,디스이즈네버댓,Arch-Logo Hoodie Violet,35600,Purple,Hoodie,Low,Yes
h11.jpg,페플,유스풀 벌룬 후드집업 네이비 SJHD1327,33830,Navy,Hoodie,Low,No
h12.jpg,매든,FUNNY PULLOVER HOODIE Black,71200,Black,Hoodie,Mid,No
h13.jpg,도미넌트,Route 66 Hoodie Brown,98100,Brown,Hoodie,High,Yes
h14.jpg,세터,리벳 아플리케 포켓 로고 후드 오가닉블랙,118150,Black,Hoodie,High,Yes
h15.jpg,토마스모어,TD4-TS03 플리스 후드-블랙,49700,Black,Hoodie,Low,No
h16.jpg,퍼스텝,투 파인더 후드집업 그레이 JUHD4453,42600,Gray,Hoodie,Low,No
h17.jpg,테일러스튜디오,엔비엘 Hoodie (버건디),42415,Red,Hoodie,Low,Yes
h18.jpg,디스이즈네버댓,Hooded Zip Up Sweater Navy,172080,Navy,Hoodie,High,No
h19.jpg,퍼스탭,뉴잭시티 후드 브라운 SMHD4455,43,900,Brown,Hoodie,Low,Yes
h20.jpg,스노우피크 어패럴,유니온 후디 Olive (S22FURHD60),69000,Ivory,Hoodie.Mid,No
